{
    "_id": 269,
    "key": "dustox",
    "name": {
        "english": "Dustox",
        "spanish": "Dustox",
        "italian": "Dustox",
        "japanese": "ドクケイル",
        "chinese": "毒粉蛾",
        "korean": "",
        "german": "Pudox",
        "french": "Papinox"
    },
    "type": {
        "one": "Bug",
        "two": "Poison"
    },
    "abilities": {
        "one": {
            "name": "Shield Dust",
            "id": 19
        },
        "hidden": {
            "name": "Compound Eyes",
            "id": 14
        }
    },
    "baseStats": {
        "hp": 60,
        "atk": 50,
        "def": 70,
        "spatk": 50,
        "spdef": 90,
        "spd": 65,
        "total": 385
    },
    "info": {
        "height": "1.2 m (3′11″)",
        "weight": "31.6 kg (69.7 lbs)"
    },
    "gender": {
        "male": "50%",
        "female": "50%",
        "genderless": false
    },
    "evolution": 91,
    "generation": 3,
    "evs": {
        "spdef": 3
    },
    "eggGroups": [
        "Bug"
    ],
    "species": "Poison Moth Pokémon",
    "catchRate": 45,
    "baseFriendship": 50,
    "baseExp": 173,
    "growthRate": "Medium Fast",
    "eggCycles": 15,
    "nameOrigin": {
        "dust": "fine, dry particles",
        "toxic": "poisonous"
    },
    "pokedexEntries": {
        "Dustox": [
            {
                "game": "ruby",
                "desc": "DUSTOX is instinctively drawn to light. Swarms of this POKéMON are attracted by the bright lights of cities, where they wreak havoc by stripping the leaves off roadside trees for food."
            },
            {
                "game": "sapphire",
                "desc": "When DUSTOX flaps its wings, a fine dust is scattered all over. This dust is actually a powerful poison that will even make a pro wrestler sick. This POKéMON searches for food using its antennae like radar."
            },
            {
                "game": "fire-red-leaf-green",
                "desc": "It scatters horribly toxic dust when it senses danger. They tend to gather in the glow of streetlamps at night."
            },
            {
                "game": "emerald",
                "desc": "It is a nocturnal POKéMON that flies from fields and mountains to the attraction of streetlights at night. It looses highly toxic powder from its wings."
            },
            {
                "game": "diamond",
                "desc": "A nocturnal Pokémon. Drawn by streetlights, they messily eat the leaves of trees lining boulevards."
            },
            {
                "game": "pearl",
                "desc": "It violently flutters its wings to scatter toxic dust when attacked. It becomes active after sunset."
            },
            {
                "game": "platinum",
                "desc": "Toxic powder is scattered with each flap. At night, it is known to strip leaves off trees lining boulevards."
            },
            {
                "game": "heart-gold-soul-silver",
                "desc": "It scatters its fine dust all over when it is attacked. It is a nocturnal Pokémon."
            },
            {
                "game": "black-white-black-2-white-2",
                "desc": "Toxic powder is scattered with each flap. At night, it is known to strip leaves off trees lining boulevards."
            },
            {
                "game": "x",
                "desc": "A nocturnal Pokémon. Drawn by streetlights, they messily eat the leaves of trees lining boulevards."
            },
            {
                "game": "y",
                "desc": "It violently flutters its wings to scatter toxic dust when attacked. It becomes active after sunset."
            },
            {
                "game": "omega-ruby",
                "desc": "Dustox is instinctively drawn to light. Swarms of this Pokémon are attracted by the bright lights of cities, where they wreak havoc by stripping the leaves off roadside trees for food."
            },
            {
                "game": "alpha-sapphire",
                "desc": "When Dustox flaps its wings, a fine dust is scattered all over. This dust is actually a powerful poison that will even make a pro wrestler sick. This Pokémon searches for food using its antennae like radar."
            },
            {
                "game": "brilliant-diamond",
                "desc": "Dustox are nocturnal Pokémon. Drawn by streetlights, they messily eat the leaves of trees lining boulevards."
            },
            {
                "game": "shining-pearl",
                "desc": "It violently flutters its wings to scatter toxic dust when attacked. It becomes active after sunset."
            },
            {
                "game": "legends-arceus",
                "desc": "Tends to be drawn to bonfires on dark nights. Difficult to chase away from settlements because of the way it scatters highly toxic scales."
            }
        ]
    }
}
