{
  "_id": 283,
  "key": "surskit",
  "name": {
    "english": "Surskit",
    "spanish": "Surskit",
    "italian": "Surskit",
    "japanese": "アメタマ",
    "chinese": "溜溜糖球",
    "korean": "",
    "german": "Gehweiher",
    "french": "Arakdo"
  },
  "pokedexNumber": {
    "ruby-sapphire": 32,
    "emerald": 32,
    "x-y-central": 47,
    "omega-ruby-alpha-sapphire": 33,
    "sun-moon-akala": 66,
    "sun-moon-ulaula": 60,
    "ultra-sun-ultra-moon": 172,
    "ultra-sun-ultra-moon-akala": 73,
    "ultra-sun-ultra-moon-ulaula": 66,
    "scarlet-violet": 49,
    "the-teal-mask": 149
  },
  "type": {
    "one": "Bug",
    "two": "Water"
  },
  "abilities": {
    "one": {
      "name": "Swift Swim",
      "id": 33
    },
    "hidden": {
      "name": "Rain Dish",
      "id": 44
    }
  },
  "baseStats": {
    "hp": 40,
    "atk": 30,
    "def": 32,
    "spatk": 50,
    "spdef": 52,
    "spd": 65,
    "total": 269
  },
  "info": {
    "height": "0.5 m (1′08″)",
    "weight": "1.7 kg (3.7 lbs)"
  },
  "gender": {
    "male": "50%",
    "female": "50%",
    "genderless": false
  },
  "evolution": 97,
  "generation": 3,
  "evs": {
    "spd": 1
  },
  "eggGroups": [
    "Water 1",
    "Bug"
  ],
  "species": "Pond Skater Pokémon",
  "catchRate": 200,
  "baseFriendship": 50,
  "baseExp": 54,
  "growthRate": "Medium Fast",
  "eggCycles": 15,
  "nameOrigin": {
    "surface": "outside or top of an object, e.g. a lake",
    "skitter": "to skim along a surface (esp. water)"
  },
  "pokedexEntries": {
    "Surskit": [
      {
        "game": "ruby",
        "desc": "From the tips of its feet, SURSKIT secretes an oil that enables it to walk on water as if it were skating. This POKéMON feeds on microscopic organisms in ponds and lakes."
      },
      {
        "game": "sapphire",
        "desc": "If SURSKIT senses danger, it secretes a thick, sugary syrup from the tip of its head. There are some POKéMON that love eating this syrup."
      },
      {
        "game": "fire-red-leaf-green",
        "desc": "They usually live on ponds, but after an evening shower, they may appear on puddles in towns."
      },
      {
        "game": "emerald",
        "desc": "They gather on puddles after evening downpours, gliding across the surface of water as if sliding. It secretes honey with a sweet aroma from its head."
      },
      {
        "game": "diamond-pearl-platinum",
        "desc": "It appears as if it is skating on water. It draws prey with a sweet scent from the tip of its head."
      },
      {
        "game": "heart-gold-soul-silver",
        "desc": "It secretes a thick, sweet-scented syrup from the tip of its head. It lives on weed-choked ponds."
      },
      {
        "game": "black-white-black-2-white-2",
        "desc": "It appears as if it is skating on water. It draws prey with a sweet scent from the tip of its head."
      },
      {
        "game": "x",
        "desc": "They usually live on ponds, but after an evening shower, they may appear on puddles in towns."
      },
      {
        "game": "y",
        "desc": "It appears as if it is skating on water. It draws prey with a sweet scent from the tip of its head."
      },
      {
        "game": "omega-ruby",
        "desc": "From the tips of its feet, Surskit secretes an oil that enables it to walk on water as if it were skating. This Pokémon feeds on microscopic organisms in ponds and lakes."
      },
      {
        "game": "alpha-sapphire",
        "desc": "If Surskit senses danger, it secretes a thick, sugary syrup from the tip of its head. There are some Pokémon that love eating this syrup."
      },
      {
        "game": "sun",
        "desc": "It moves as if skating on the surface of the water. It often fights with Dewpider over food."
      },
      {
        "game": "moon",
        "desc": "When this Pokémon senses danger, a sweet fluid oozes from the tip of its head. The taste of it disgusts bird Pokémon."
      },
      {
        "game": "ultra-sun",
        "desc": "If it’s in a pinch, it will secrete a sweet liquid from the tip of its head. Syrup made from gathering that liquid is tasty on bread."
      },
      {
        "game": "ultra-moon",
        "desc": "It lives in ponds and marshes that feature lots of plant life. It often fights with Dewpider, whose habitat and diet are similar."
      },
      {
        "game": "brilliant-diamond-shining-pearl",
        "desc": "It appears as if it is skating on water. It draws prey in with a sweet scent released from the tip of its head."
      }
    ]
  }
}