{
  "_id": 38,
  "key": "ninetales",
  "name": {
    "english": "Ninetales",
    "spanish": "Ninetales",
    "italian": "Ninetales",
    "japanese": "キュウコン",
    "chinese": "九尾",
    "korean": "",
    "german": "Vulnona",
    "french": "Feunard"
  },
  "pokedexNumber": {
    "red-blue": 38,
    "yellow": 38,
    "gold-silver": 126,
    "crystal": 126,
    "ruby-sapphire": 154,
    "emerald": 154,
    "firered-leafgreen": 38,
    "heartgold-soulsilver": 128,
    "black-2-white-2": 249,
    "omega-ruby-alpha-sapphire": 161,
    "sun-moon-ulaula": 268,
    "ultra-sun-ultra-moon": 331,
    "lets-go-pikachu-eevee": 38,
    "sword-shield": 69,
    "legends-arceus": 169,
    "the-teal-mask": 38
  },
  "type": {
    "one": "Fire"
  },
  "abilities": {
    "one": {
      "name": "Flash Fire",
      "id": 18
    },
    "hidden": {
      "name": "Drought",
      "id": 70
    }
  },
  "baseStats": {
    "hp": 73,
    "atk": 76,
    "def": 75,
    "spatk": 81,
    "spdef": 100,
    "spd": 100,
    "total": 505
  },
  "info": {
    "height": "1.1 m (3′07″)",
    "weight": "19.9 kg (43.9 lbs)"
  },
  "gender": {
    "male": "25%",
    "female": "75%",
    "genderless": false
  },
  "evolution": 15,
  "generation": 1,
  "evs": {
    "spdef": 1,
    "spd": 1
  },
  "eggGroups": [
    "Field"
  ],
  "species": "Fox Pokémon",
  "catchRate": 75,
  "baseFriendship": 50,
  "baseExp": 177,
  "growthRate": "Medium Fast",
  "eggCycles": 20,
  "nameOrigin": {
    "nine": "its number of tails",
    "tales": "corruption of ‘tails’"
  },
  "pokedexEntries": {
    "Ninetales": [
      {
        "game": "red-blue",
        "desc": "Very smart and very vengeful. Grabbing one of its many tails could result in a 1000-year curse."
      },
      {
        "game": "yellow",
        "desc": "According to an enduring legend, 9 noble saints were united and reincarnated as this POKéMON."
      },
      {
        "game": "gold",
        "desc": "Some legends claim that each of its nine tails has its own unique type of special mystical power."
      },
      {
        "game": "silver",
        "desc": "Its nine beautiful tails are filled with a wondrous energy that could keep it alive for 1,000 years."
      },
      {
        "game": "crystal",
        "desc": "It is said to live a thousand years, and each of its tails is loaded with supernatural powers."
      },
      {
        "game": "ruby",
        "desc": "NINETALES casts a sinister light from its bright red eyes to gain total control over its foe’s mind. This POKéMON is said to live for a thousand years."
      },
      {
        "game": "sapphire",
        "desc": "Legend has it that NINETALES came into being when nine wizards possessing sacred powers merged into one. This POKéMON is highly intelligent - it can understand human speech."
      },
      {
        "game": "fire-red",
        "desc": "It has nine long tails and fur that gleams gold. It is said to live for 1,000 years."
      },
      {
        "game": "leaf-green",
        "desc": "Very smart and very vengeful. Grabbing one of its many tails could result in a 1,000-year curse."
      },
      {
        "game": "emerald",
        "desc": "It has long been said that each of the nine tails embody an enchanted power. A long-lived NINETALES will have fur that shines like gold."
      },
      {
        "game": "diamond-pearl-platinum",
        "desc": "Its nine tails are said to be imbued with a mystic power. It can live for a thousand years."
      },
      {
        "game": "heart-gold",
        "desc": "Some legends claim that each of its nine tails has its own unique type of special mystical power."
      },
      {
        "game": "soul-silver",
        "desc": "Its nine beautiful tails are filled with a wondrous energy that could keep it alive for 1,000 years."
      },
      {
        "game": "black-white",
        "desc": "Its nine tails are said to be imbued with a mystic power. It can live for a thousand years."
      },
      {
        "game": "black-2-white-2",
        "desc": "Each of its nine tails is imbued with supernatural power, and it can live for a thousand years."
      },
      {
        "game": "x",
        "desc": "It has nine long tails and fur that gleams gold. It is said to live for 1,000 years."
      },
      {
        "game": "y",
        "desc": "Very smart and very vengeful. Grabbing one of its many tails could result in a 1,000-year curse."
      },
      {
        "game": "omega-ruby",
        "desc": "Ninetales casts a sinister light from its bright red eyes to gain total control over its foe’s mind. This Pokémon is said to live for a thousand years."
      },
      {
        "game": "alpha-sapphire",
        "desc": "Legend has it that Ninetales came into being when nine wizards possessing sacred powers merged into one. This Pokémon is highly intelligent—it can understand human speech."
      },
      {
        "game": "sun",
        "desc": "Legend has it that this mystical Pokémon was formed when nine saints coalesced into one."
      },
      {
        "game": "moon",
        "desc": "Said to live for a thousand years, this Pokémon uses its supernatural abilities to manipulate fire. It can burn its prey to a crisp as it pleases."
      },
      {
        "game": "ultra-sun",
        "desc": "It is vindictive and relentless by nature. Those who cross it even once will be cursed for a thousand years, along with their descendants."
      },
      {
        "game": "ultra-moon",
        "desc": "The flickering flames it spews from its mouth leave its opponents hypnotized. Then, this extremely intelligent Pokémon attacks."
      },
      {
        "game": "lets-go-pikachu-eevee",
        "desc": "According to an enduring legend, nine noble saints were united and reincarnated as this Pokémon."
      },
      {
        "game": "sword",
        "desc": "It is said to live 1,000 years, and each of its tails is loaded with supernatural powers."
      },
      {
        "game": "shield",
        "desc": "Very smart and very vengeful. Grabbing one of its many tails could result in a 1,000-year curse."
      },
      {
        "game": "brilliant-diamond-shining-pearl",
        "desc": "Its nine tails are said to be imbued with a mystic power. The Pokémon is said to live for 1,000 years."
      },
      {
        "game": "legends-arceus",
        "desc": "The coat of gleaming golden fur is quite magnificent. This species is said to store sacred power in its nine long tails and to live for a millennium."
      }
    ]
  }
}