{
  "_id": 786,
  "key": "tapu-lele",
  "name": {
    "english": "Tapu Lele",
    "spanish": "Tapu Lele",
    "italian": "Tapu Lele",
    "japanese": "カプ・テテフ",
    "chinese": "卡璞・蝶蝶",
    "korean": "",
    "german": "Kapu-Fala",
    "french": "Tokotoro"
  },
  "pokedexNumber": {
    "sun-moon": 286,
    "sun-moon-akala": 299,
    "ultra-sun-ultra-moon": 384,
    "ultra-sun-ultra-moon-akala": 160
  },
  "type": {
    "one": "Psychic",
    "two": "Fairy"
  },
  "abilities": {
    "one": {
      "name": "Psychic Surge",
      "id": 227
    },
    "hidden": {
      "name": "Telepathy",
      "id": 140
    }
  },
  "baseStats": {
    "hp": 70,
    "atk": 85,
    "def": 75,
    "spatk": 130,
    "spdef": 115,
    "spd": 95,
    "total": 570
  },
  "info": {
    "height": "1.2 m (3′11″)",
    "weight": "18.6 kg (41.0 lbs)"
  },
  "gender": {
    "male": "",
    "female": "",
    "genderless": true
  },
  "evolution": null,
  "generation": 7,
  "evs": {
    "spatk": 3
  },
  "eggGroups": [
    "Undiscovered"
  ],
  "species": "Land Spirit Pokémon",
  "catchRate": 3,
  "baseFriendship": 50,
  "baseExp": 257,
  "growthRate": "Slow",
  "eggCycles": 15,
  "nameOrigin": {
    "tapu": "Hawaiian for ‘holy’",
    "pulelehua": "Hawaiian for ‘butterfly’"
  },
  "pokedexEntries": {
    "Tapu-lele": [
      {
        "game": "sun",
        "desc": "This guardian deity of Akala is guilelessly cruel. The fragrant aroma of flowers is the source of its energy."
      },
      {
        "game": "moon",
        "desc": "As it flutters about, it scatters its strangely glowing scales. Touching them is said to restore good health on the spot."
      },
      {
        "game": "ultra-sun",
        "desc": "It heals the wounds of people and Pokémon by sprinkling them with its sparkling scales. This guardian deity is worshiped on Akala."
      },
      {
        "game": "ultra-moon",
        "desc": "Although called a guardian deity, Tapu Lele is devoid of guilt about its cruel disposition and can be described as nature incarnate."
      }
    ]
  }
}