{
  "_id": 370,
  "key": "luvdisc",
  "name": {
    "english": "Luvdisc",
    "spanish": "Luvdisc",
    "italian": "Luvdisc",
    "japanese": "ラブカス",
    "chinese": "爱心鱼",
    "korean": "",
    "german": "Liebiskus",
    "french": "Lovdisc"
  },
  "pokedexNumber": {
    "ruby-sapphire": 183,
    "emerald": 183,
    "x-y-coastal": 29,
    "omega-ruby-alpha-sapphire": 192,
    "sun-moon": 111,
    "sun-moon-melemele": 111,
    "sun-moon-akala": 111,
    "ultra-sun-ultra-moon": 134,
    "ultra-sun-ultra-moon-melemele": 134,
    "ultra-sun-ultra-moon-akala": 43,
    "scarlet-violet": 332,
    "the-indigo-disk": 82
  },
  "type": {
    "one": "Water"
  },
  "abilities": {
    "one": {
      "name": "Swift Swim",
      "id": 33
    },
    "hidden": {
      "name": "Hydration",
      "id": 93
    }
  },
  "baseStats": {
    "hp": 43,
    "atk": 30,
    "def": 55,
    "spatk": 40,
    "spdef": 65,
    "spd": 97,
    "total": 330
  },
  "info": {
    "height": "0.6 m (2′00″)",
    "weight": "8.7 kg (19.2 lbs)"
  },
  "gender": {
    "male": "25%",
    "female": "75%",
    "genderless": false
  },
  "evolution": null,
  "generation": 3,
  "evs": {
    "spd": 1
  },
  "eggGroups": [
    "Water 2"
  ],
  "species": "Rendezvous Pokémon",
  "catchRate": 225,
  "baseFriendship": 50,
  "baseExp": 116,
  "growthRate": "Fast",
  "eggCycles": 20,
  "nameOrigin": {
    "love": "profound affection",
    "disc": "circular shape"
  },
  "pokedexEntries": {
    "Luvdisc": [
      {
        "game": "ruby",
        "desc": "LUVDISC live in shallow seas in the tropics. This heart-shaped POKéMON earned its name by swimming after loving couples it spotted in the ocean’s waves."
      },
      {
        "game": "sapphire",
        "desc": "LUVDISC’s heart-shaped body is a symbol of love and romance. It is said that any couple meeting this POKéMON is promised a loving relationship that never ends."
      },
      {
        "game": "fire-red-leaf-green",
        "desc": "During the spawning season, countless LUVDISC congregate at coral reefs, turning the waters pink."
      },
      {
        "game": "emerald",
        "desc": "LUVDISC make the branches of CORSOLA their nests. There is a custom from long ago of giving a LUVDISC as a gift to express one’s feelings of love."
      },
      {
        "game": "diamond-pearl-platinum",
        "desc": "It lives in warm seas. It is said that a couple finding this Pokémon will be blessed with eternal love."
      },
      {
        "game": "heart-gold-soul-silver",
        "desc": "Its heart-shaped body makes it popular. In some places, you would give a LUVDISC to someone you love."
      },
      {
        "game": "black-white-black-2-white-2",
        "desc": "It lives in warm seas. It is said that a couple finding this Pokémon will be blessed with eternal love."
      },
      {
        "game": "x",
        "desc": "It lives in warm seas. It is said that a couple finding this Pokémon will be blessed with eternal love."
      },
      {
        "game": "y",
        "desc": "During the spawning season, countless Luvdisc congregate at coral reefs, turning the waters pink."
      },
      {
        "game": "omega-ruby",
        "desc": "Luvdisc live in shallow seas in the tropics. This heart-shaped Pokémon earned its name by swimming after loving couples it spotted in the ocean’s waves."
      },
      {
        "game": "alpha-sapphire",
        "desc": "Luvdisc’s heart-shaped body is a symbol of love and romance. It is said that any couple meeting this Pokémon is promised a loving relationship that never ends."
      },
      {
        "game": "sun",
        "desc": "If a Luvdisc is left on its own, it becomes despondent, leaving itself open to attack. That is when Pelipper snatch them up."
      },
      {
        "game": "moon",
        "desc": "Loving couples have a soft spot for this Pokémon, so honeymoon hotels often release this Pokémon into their pools."
      },
      {
        "game": "ultra-sun",
        "desc": "There was an era when it was overfished due to the rumor that having one of its heart-shaped scales would enable you to find a sweetheart."
      },
      {
        "game": "ultra-moon",
        "desc": "Luvdisc makes its home in coral reefs in warm seas. It especially likes sleeping in the space between Corsola’s branches."
      },
      {
        "game": "brilliant-diamond-shining-pearl",
        "desc": "It lives in warm seas. It is said that couples who find this Pokémon will be blessed with eternal love."
      }
    ]
  }
}