{
    "_id": 365,
    "key": "walrein",
    "name": {
        "english": "Walrein",
        "spanish": "Walrein",
        "italian": "Walrein",
        "japanese": "トドゼルガ",
        "chinese": "帝牙海狮",
        "korean": "",
        "german": "Walraisa",
        "french": "Kaimorse"
    },
    "type": {
        "one": "Ice",
        "two": "Water"
    },
    "abilities": {
        "one": {
            "name": "Thick Fat",
            "id": 47
        },
        "two": {
            "name": "Ice Body",
            "id": 115
        },
        "hidden": {
            "name": "Oblivious",
            "id": 12
        }
    },
    "baseStats": {
        "hp": 110,
        "atk": 80,
        "def": 90,
        "spatk": 95,
        "spdef": 90,
        "spd": 65,
        "total": 530
    },
    "info": {
        "height": "1.4 m (4′07″)",
        "weight": "150.6 kg (332.0 lbs)"
    },
    "gender": {
        "male": "50%",
        "female": "50%",
        "genderless": false
    },
    "evolution": 124,
    "generation": 3,
    "evs": {},
    "eggGroups": [
        "Water 1",
        "Field"
    ],
    "species": "Ice Break Pokémon",
    "catchRate": 45,
    "baseFriendship": 50,
    "baseExp": 239,
    "growthRate": "Medium Slow",
    "eggCycles": 20,
    "nameOrigin": {
        "walrus": "marine creature",
        "reign": "to rule over others, like royalty"
    },
    "pokedexEntries": {
        "Walrein": [
            {
                "game": "ruby",
                "desc": "WALREIN’s two massively developed tusks can totally shatter blocks of ice weighing ten tons with one blow. This POKéMON’s thick coat of blubber insulates it from subzero temperatures."
            },
            {
                "game": "sapphire",
                "desc": "WALREIN swims all over in frigid seawater while crushing icebergs with its grand, imposing tusks. Its thick layer of blubber makes enemy attacks bounce off harmlessly."
            },
            {
                "game": "fire-red-leaf-green",
                "desc": "It swims through icy seas while shattering ice floes with its large tusks. It is protected by its thick blubber."
            },
            {
                "game": "emerald",
                "desc": "To protect its herd, the leader battles anything that invades its territory, even at the cost of its life. Its tusks may snap off in battle."
            },
            {
                "game": "diamond-pearl-platinum",
                "desc": "It shatters ice with its big tusks. Its thick blubber repels not only the cold, but also enemy attacks."
            },
            {
                "game": "heart-gold-soul-silver",
                "desc": "It shatters drift ice with its strong tusks. Its thick layer of blubber repels enemy attacks."
            },
            {
                "game": "black-white",
                "desc": "It shatters ice with its big tusks. Its thick blubber repels not only the cold, but also enemy attacks."
            },
            {
                "game": "black-2-white-2",
                "desc": "Not only does its thick blubber keep it warm, it also protects it from attacks. It shatters ice with its prized tusks."
            },
            {
                "game": "x",
                "desc": "It shatters ice with its big tusks. Its thick blubber repels not only the cold, but also enemy attacks."
            },
            {
                "game": "y",
                "desc": "It shatters drift ice with its strong tusks. Its thick layer of blubber repels enemy attacks."
            },
            {
                "game": "omega-ruby",
                "desc": "Walrein’s two massively developed tusks can totally shatter blocks of ice weighing 10 tons with one blow. This Pokémon’s thick coat of blubber insulates it from subzero temperatures."
            },
            {
                "game": "alpha-sapphire",
                "desc": "Walrein swims all over in frigid seawater while crushing icebergs with its grand, imposing tusks. Its thick layer of blubber makes enemy attacks bounce off harmlessly."
            },
            {
                "game": "sword",
                "desc": "Walrein form herds of 20 to 30 individuals. When a threat appears, the herd’s leader will protect the group with its life."
            },
            {
                "game": "shield",
                "desc": "Walrein’s tusks keep growing throughout its life. Tusks broken in battle will grow back to their usual impressive size in a year."
            },
            {
                "game": "brilliant-diamond-shining-pearl",
                "desc": "It shatters ice with its big tusks. Its thick blubber repels not only the cold but also enemy attacks."
            },
            {
                "game": "legends-arceus",
                "desc": "Its thick tusks are strong enough to shatter drift ice. They have been known to break, but they will grow back by the next year. The Hisui region is well known for these broken tusks."
            }
        ]
    }
}
