{
  "_id": 375,
  "key": "metang",
  "name": {
    "english": "Metang",
    "spanish": "Metang",
    "italian": "Metang",
    "japanese": "メタング",
    "chinese": "金属怪",
    "korean": "",
    "german": "Metang",
    "french": "Métang"
  },
  "pokedexNumber": {
    "ruby-sapphire": 191,
    "emerald": 191,
    "black-2-white-2": 263,
    "omega-ruby-alpha-sapphire": 200,
    "sun-moon": 215,
    "sun-moon-ulaula": 87,
    "ultra-sun-ultra-moon": 279,
    "ultra-sun-ultra-moon-ulaula": 100,
    "crown-tundra": 130,
    "the-indigo-disk": 138
  },
  "type": {
    "one": "Steel",
    "two": "Psychic"
  },
  "abilities": {
    "one": {
      "name": "Clear Body",
      "id": 29
    },
    "hidden": {
      "name": "Light Metal",
      "id": 135
    }
  },
  "baseStats": {
    "hp": 60,
    "atk": 75,
    "def": 100,
    "spatk": 55,
    "spdef": 80,
    "spd": 50,
    "total": 420
  },
  "info": {
    "height": "1.2 m (3′11″)",
    "weight": "202.5 kg (446.4 lbs)"
  },
  "gender": {
    "male": "",
    "female": "",
    "genderless": true
  },
  "evolution": 127,
  "generation": 3,
  "evs": {
    "def": 2
  },
  "eggGroups": [
    "Mineral"
  ],
  "species": "Iron Claw Pokémon",
  "catchRate": 3,
  "baseFriendship": 35,
  "baseExp": 147,
  "growthRate": "Slow",
  "eggCycles": 40,
  "nameOrigin": {
    "metal": "solid material",
    "tang": "sound of metal being struck"
  },
  "pokedexEntries": {
    "Metang": [
      {
        "game": "ruby",
        "desc": "When two BELDUM fuse together, METANG is formed. The brains of the BELDUM are joined by a magnetic nervous system. By linking its brains magnetically, this POKéMON generates strong psychokinetic power."
      },
      {
        "game": "sapphire",
        "desc": "When two BELDUM fuse together, METANG is formed. The brains of the BELDUM are joined by a magnetic nervous system. This POKéMON turns its arms to the rear for traveling at high speed."
      },
      {
        "game": "fire-red-leaf-green",
        "desc": "It floats midair using magnetism. Its body is so tough, even a crash with a jet plane won’t leave a scratch."
      },
      {
        "game": "emerald",
        "desc": "The claws tipping its arms pack the destructive power to tear through thick iron sheets as if they were silk. It flies at over 60 miles per hour."
      },
      {
        "game": "diamond-pearl-platinum",
        "desc": "It is formed by two BELDUM joining together. Its steel body won’t be scratched if it collides with a jet."
      },
      {
        "game": "heart-gold-soul-silver",
        "desc": "When two BELDUM fuse together, a magnetic nervous system places their brains in union."
      },
      {
        "game": "black-white",
        "desc": "It is formed by two Beldum joining together. Its steel body won’t be scratched if it collides with a jet."
      },
      {
        "game": "black-2-white-2",
        "desc": "It is formed by two Beldum joining together. Its two brains are linked, amplifying its psychic power."
      },
      {
        "game": "x",
        "desc": "It is formed by two Beldum joining together. Its steel body won’t be scratched if it collides with a jet."
      },
      {
        "game": "y",
        "desc": "It is formed by two Beldum joining together. Its two brains are linked, amplifying its psychic power."
      },
      {
        "game": "omega-ruby",
        "desc": "When two Beldum fuse together, Metang is formed. The brains of the Beldum are joined by a magnetic nervous system. By linking its brains magnetically, this Pokémon generates strong psychokinetic power."
      },
      {
        "game": "alpha-sapphire",
        "desc": "When two Beldum fuse together, Metang is formed. The brains of the Beldum are joined by a magnetic nervous system. This Pokémon turns its arms to the rear for traveling at high speed."
      },
      {
        "game": "sun",
        "desc": "When two Beldum link together, their psychic power is doubled. Their intelligence, however, remains unchanged."
      },
      {
        "game": "moon",
        "desc": "It adores magnetic minerals, so it pursues Nosepass at speeds exceeding 60 mph."
      },
      {
        "game": "ultra-sun",
        "desc": "With its two brains, it fires powerful psychic energy to stop its prey in their tracks."
      },
      {
        "game": "ultra-moon",
        "desc": "It flies at high speeds around the skies. When it finds its prey, Metang takes a firm grip with its sharp claws and never lets go."
      },
      {
        "game": "sword",
        "desc": "Two Beldum have become stuck together via their own magnetic forces. With two brains, the resulting Metang has doubled psychic powers."
      },
      {
        "game": "shield",
        "desc": "Using magnetic forces to stay aloft, this Pokémon flies at high speeds, weaving through harsh mountain terrain in pursuit of prey."
      },
      {
        "game": "brilliant-diamond-shining-pearl",
        "desc": "It is formed by two Beldum joining together. Its steel body won’t be scratched if it collides with a jet."
      }
    ]
  }
}